"Company Name",Address,Website,"Contact Nos.",State
"Web Design Philippines","Unit 309, PBS Building, 72, Kamias Road, East Kamias, Quezon City, 1102 Metro Manila, Philippines",,,"Metro Manila"
"Halcyon Web Design","11 San Antonio St, Pasig, 1603 Metro Manila, Philippines",,,"Metro Manila"
"Ecotribe Online Web Development Team","23, Jasmin Street, Marulas, Happy Site, Valenzuela, 1440 Metro Manila, Philippines",,,"Metro Manila"
"WebFocus Solutions, Inc.","One San Miguel Building, 1 San Miguel Ave, San Antonio, Pasig, Metro Manila, Philippines",,,"Metro Manila"
"MAXWEB, Inc.","465 Malaya, Mandaluyong, 1550 Metro Manila, Philippines",,,"Metro Manila"
"Quazar Designs","7B Tolentino Street, San Francisco del Monte, Quezon City, 1105 Metro Manila, Philippines",,,"Metro Manila"
"RMDC Digital Marketing","1660, E Rodriguez Sr. Ave, Quezon City, 1111 Metro Manila, Philippines",,,"Metro Manila"
"Sonny Design","Bagong Tanyag Street, Taguig City, Metro Manila, Philippines",,,"Metro Manila"
"Website Express","Ricogen Building, 112 Aguirre, Makati, Metro Manila, Philippines",,,"Metro Manila"
"Manila Web Designs","Oranbo Dr, Pasig, Metro Manila, Philippines",,,"Metro Manila"
"Artzap Studio - Web Design Manila Philippines","Unit 6N, Madrigal Business Park, Investment Dr, Ayala Alabang, Muntinlupa, 1780 Metro Manila, Philippines",,,"Metro Manila"
"Online Thinkers Technology","Chateau Valenzuela, P. Gregorio St., Brgy., Lingunan, Valenzuela, 1446, Philippines",,,"Metro Manila"
"eGlobalMD Web Services and Solutions","Mindanao Nova Realty Building, Mindanao Avenue, Novaliches, Quezon City, Metro Manila, Philippines",,,"Metro Manila"
"I-MAP WEBSOLUTIONS, INC","Epifanio de los Santos Ave, Makati, 1232 Metro Manila, Philippines",,,"Metro Manila"
"Ninja Consulting PH Incorporated","820 City and Land Megaplaza ADB Avenue cor, San Antonio, Pasig, Metro Manila, Philippines",,,"Metro Manila"
"High6 Creatives","Quezon Street, 6th Ave, Building 8, Caloocan, 1400 Metro Manila, Philippines",,,"Metro Manila"
"monk3ybidzness | web services","Tawiran Extension Street, 6th, Santolan, Pasig, 1610 Metro Manila, Philippines",,,"Metro Manila"
"TechCellar Business Solutions","393 Sen. Gil J. Puyat Ave, Makati, Metro Manila, Philippines",,,"Metro Manila"
"Netineers Web Design","King Center Building, Sgt. Rivera Street, Quezon City, Metro Manila, Philippines",,,"Metro Manila"
"Philippine Web Accessibility Group","MCCID Building, 807 Aurora Boulevard, Immaculate Concepcion, Quezon City, 1111 Metro Manila, Philippines",,,"Metro Manila"
"Jutsu Graphic Design Company","V.A. Rufino Corner Valero Street, Makati, 1224 Metro Manila, Philippines",,,"Metro Manila"
"Web Designer Philippines","Bagong Lipunan Ng Crame, Quezon City, Metro Manila, Philippines",,,"Metro Manila"
Designlabworks.com,"5 Filipinas Ave, Parañaque, 1713 Metro Manila, Philippines",,,"Metro Manila"
"Sytian Productions","125 Sikatuna Bliss 1, Bldg. 1, 1101, Philippines",,,"Metro Manila"
"ZAIN Web Design Services Company","1200 Bocobo St, Ermita, Manila, 1000 Metro Manila, Philippines",,,"Metro Manila"
"Freelance WordPress Designer Jasper Espejo","Ipil Street, Greenwoods Executive Village, Cainta, 1900 Rizal, Philippines",,,"Metro Manila"
Webtogo,"Unit 2009, Prestige Tower, F.Ortigas Jr. Road, Ortigas Center 1605, Philippines",,,"Metro Manila"
Etnmultimedia,"Diliman, Quezon City, 1100, Philippines",,,"Metro Manila"
